{
  "$schema": "./project.identity.schema.json",
  "version": 1,
  "project": {
    "name": "THRY",
    "slug": "thry",
    "repo": "thrycoproduct-ux/thry",
    "branch": "main"
  },
  "site": {
    "canonicalOrigin": "https://thryco.com",
    "wwwOrigin": "https://www.thryco.com",
    "localOrigins": [
      "http://localhost:3000",
      "http://127.0.0.1:3000",
      "https://thryco.com",
      "https://www.thryco.com",
      "https://thry.thrycoproduct.workers.dev",
      "https://thry-thryco.vercel.app",
      "https://thry-self.vercel.app"
    ]
  },
  "supabase": {
    "projectRef": "azqgyxdzwlhdmjvkngbs",
    "url": "https://azqgyxdzwlhdmjvkngbs.supabase.co",
    "regionHint": "ap-south-1"
  },
  "cloudflare": {
    "accountEmail": "thrycoproduct@gmail.com",
    "accountId": "77dfa9b757691b2321fe0630f01c8c6a",
    "workerName": "thry",
    "mediaWorkerName": "thry-media",
    "catalogWorkerName": "thry-catalog",
    "catalogWorkerUrl": "https://thry-catalog.thrycoproduct.workers.dev",
    "catalogWranglerConfig": "workers/thry-catalog/wrangler.jsonc",
    "productionWranglerConfig": "wrangler.workers.new-account.jsonc",
    "mediaWranglerConfig": "workers/r2-media-proxy/wrangler.jsonc",
    "d1": {
      "catalogDatabaseName": "thry-catalog",
      "catalogDatabaseId": "85283c0d-4c77-4187-8d68-ff166a1a6d50",
      "primaryLocationHint": "APAC"
    },
    "r2": {
      "mediaBucket": "thry-cdn",
      "nextCacheBucket": "thry-next-cache",
      "s3Endpoint": "https://77dfa9b757691b2321fe0630f01c8c6a.r2.cloudflarestorage.com",
      "publicCdnHint": "https://pub-7298c413a12641b5ba5dd9bff2d9009f.r2.dev",
      "mediaProxyUrl": "https://media.thryco.com"
    }
  },
  "vercel": {
    "teamSlug": "thryco",
    "teamId": "team_DAup0iV9bvGvaL1mIGH9a7al",
    "projectSlug": "thry",
    "projectId": "prj_48M3Nk6JuE9KInZf1t51ww1V6K78",
    "productionHost": "thryco.com"
  },
  "github": {
    "owner": "thrycoproduct-ux",
    "repo": "thry",
    "pushAccount": "thrycoproduct-ux"
  },
  "authRedirectOrigins": [
    "http://localhost:3000",
    "http://127.0.0.1:3000",
    "https://thryco.com",
    "https://www.thryco.com",
    "https://thry.thrycoproduct.workers.dev",
    "https://thry-thryco.vercel.app",
    "https://thry-self.vercel.app"
  ],
  "forbidden": {
    "description": "Never use these for THRY deploys, R2, env, or wrangler login.",
    "cloudflareAccountEmails": [
      "shaarunew01@gmail.com",
      "sripalanitextilesonline@gmail.com"
    ],
    "cloudflareAccountIds": [
      "542992b23690c0c07bb23e5fecffa6ec"
    ],
    "supabaseProjectRefs": [
      "xytdexahcdyhykvuwpys",
      "rzwbpjjayarptlwjfpzm",
      "qhtwwyqlsnckorndmhmt"
    ],
    "siteHosts": [
      "hubsofcraftss.com",
      "www.hubsofcraftss.com",
      "hubofcraftss.com",
      "www.hubofcraftss.com",
      "sairaghavendratex.com",
      "www.sairaghavendratex.com",
      "ssr-tex-shop.vercel.app",
      "hubs-of-craftss-project.vercel.app"
    ],
    "r2Buckets": [
      "hubofcraftss-cdn",
      "hubofcraftss-next-cache"
    ]
  },
  "notes": [
    "THRY is a NEW shop. Secrets stay in .env.local — never commit them.",
    "Cloudflare account: thrycoproduct@gmail.com / 77dfa9b757691b2321fe0630f01c8c6a",
    "Supabase project azqgyxdzwlhdmjvkngbs is the only allowed DB/auth project.",
    "Run npm run validate:identity before auth, R2, wrangler, or deploy work.",
    "Shop DNS: thryco.com / www are Cloudflare Worker custom domains on thry-shop-edge → Vercel origin (thry-thryco.vercel.app). Media is media.thryco.com (thry-media). Zone may stay Free; Workers Paid (standard) is required for shop-edge traffic."
  ]
}
